{
  "specification": {
    "standard": "DDT-VERIFICATION-REASON-CODE-REGISTRY",
    "version": "0.2.0-draft.1"
  },
  "registryId": "ddt.verification.reason-code-registry.v2",
  "lifecycleStatus": "DRAFT",
  "deploymentStatus": "TEST_ONLY",
  "reasonCodes": [
    "ALGORITHM_STATUS_UNRESOLVED",
    "ARTIFACT_DIGEST_MISMATCH",
    "ARTIFACT_UNAVAILABLE",
    "AUTHORITY_CHAIN_INCOMPLETE",
    "AUTHORITY_SCOPE_MISMATCH",
    "CHECKPOINT_CORE_HASH_MISMATCH",
    "CHECKPOINT_INCLUSION_INVALID",
    "CHECKPOINT_PREDECESSOR_MISMATCH",
    "COMPLETENESS_CONTRACT_UNAVAILABLE",
    "CONFORMANCE_FAILED",
    "DEPENDENCY_CYCLE",
    "DEPENDENCY_FAILED",
    "DEPENDENCY_UNAVAILABLE",
    "DOCUMENT_HASH_MISMATCH",
    "DOCUMENT_UNAVAILABLE",
    "EVIDENCE_UNAVAILABLE",
    "FINALITY_CONFLICT",
    "FINALITY_NOT_ESTABLISHED",
    "HISTORICAL_CONTEXT_INSUFFICIENT",
    "HISTORICAL_KEY_STATE_UNRESOLVED",
    "IDENTITY_UNRESOLVED",
    "INVALID_STATUS_FOR_AXIS",
    "NETWORK_ANCESTRY_INVALID",
    "NETWORK_PROFILE_UNAVAILABLE",
    "NETWORK_TARGET_MISMATCH",
    "NOT_APPLICABLE_TO_TARGET",
    "NOT_EVALUATED_BY_REQUEST",
    "OFFLINE_DEPENDENCY_CLOSURE_INCOMPLETE",
    "OFFLINE_EXTRACTION_UNSAFE",
    "OFFLINE_NETWORK_ACCESS_ATTEMPTED",
    "ORIGINAL_PROOF_UNVERIFIABLE",
    "PACKAGE_FILE_DIGEST_MISMATCH",
    "PRESERVATION_OBLIGATION_FAILED",
    "PROFILE_APPLICABILITY_UNRESOLVED",
    "PROFILE_DIGEST_MISMATCH",
    "PROOF_PURPOSE_TARGET_MISMATCH",
    "RECONSTRUCTION_AMBIGUOUS",
    "RECONSTRUCTION_PARTIAL",
    "RECORD_HASH_MISMATCH",
    "RENEWAL_CLASS_INVALID",
    "RENEWAL_CONTINUITY_NOT_PRESERVED",
    "RENEWAL_TIME_UNPROVEN",
    "REQUIRED_AXIS_MISSING",
    "REQUIRED_DEPENDENCY_MISSING",
    "REQUIRED_EVIDENCE_MISSING",
    "RESULT_CORE_HASH_MISMATCH",
    "RESULT_PROOF_INVALID",
    "SCHEMA_INVALID",
    "SIGNATURE_INVALID",
    "SIGNED_OBJECT_BINDING_MISMATCH",
    "SOURCE_POSITION_GAP",
    "SOURCE_STATE_MISMATCH",
    "SUBSTANTIVE_TRUTH_OUT_OF_SCOPE",
    "SUMMARY_DERIVATION_MISMATCH",
    "TARGET_COMMITMENT_UNBOUND",
    "TARGET_IDENTITY_UNRESOLVED",
    "TIME_CLAIM_UNPROVEN",
    "UNREGISTERED_AXIS",
    "UNREGISTERED_REASON_CODE",
    "VERIFICATION_METHOD_UNAVAILABLE",
    "VERIFIER_IMPLEMENTATION_UNAVAILABLE",
    "WITNESS_INDEPENDENCE_UNRESOLVED",
    "WITNESS_QUORUM_INSUFFICIENT"
  ],
  "extensionRule": {
    "reasonCodePrefix": "x:",
    "baseCodeRedefinition": "FORBIDDEN",
    "unknownBaseCode": "REJECT"
  }
}
